Ticket;Nombre comun;Fecha;evento;Ciudad;Vereda;Arboles;Hectareas
903;Guayabo araza, Protium apiculata, Hacelfia floribunda, Posoqueria latifolia, Arizá;5/12/2021 0:00;Urbanizacion Siempre Verde;Medellín;Aguas Frias;10;0.02
1855;Casco de Vaca, Guamo Machete, Guayabo Común, Carbonero, Nogal Cafetero;11/09/2021 0:00;Obligación Contractual;Medellín;Altavista Central;35;0.07
126;naranja;9/03/2020 0:00;siembra de árboles;Medellín;Altavista Central;4;0.008
576;Chirlobirlo;01/29/2020 12:00:00 AM;Sembraton tejiendo caminos;Medellín;Boqueron;800;1.6
1590;Quimulá, Fruta de pava, Alcaparro Enano, Cabo de Hacha, Niguito, Drago, Chirlobirlo;01/18/2022 12:00:00 AM;Reforestación predio estadero alto de boqueron;Medellín;Boqueron;200;0.4
1152;Quimulá, Chaquiro Real, Gallinazo, Niguito, Yolombo, Drago, Chagualo, Roble;09/19/2021 12:00:00 AM;Obligación Contractual;Medellín;Boqueron;62;0.124
312;carate rojo, Chiriguaco, Cordoncillo, Sietecueros, Chachafruto, Roble;10/02/2020 0:00;SEMBRATON;Medellín;Buga Patio Bonito;30;0.06
1299;Guayacan Polvillo, Pino Colombiano Romeron;10/28/2021 12:00:00 AM;contrato 0854-2021 obligacion arbol x millon;Medellín;El Cerro;20;0.04
1665;Quimulá, Quiebra barrigo, Cedro altura, Saúco, Sauce, Cedro Negro, Chachafruto, Chirlobirlo, Aguacatillo, Roble;08/22/2021 12:00:00 AM;siembra Voluntaria;Medellín;El Cerro;1715;3.43
985;Florentino, Mollinedia, Alcaparro Enano, Navajuelo, Amarraboyo, Cedrillo, Carate Negro, Nadador, Escobo 1, Aliso, Chagualo, Aguacatillo;05/15/2021 12:00:00 AM;Siembra de árboles contrato ps No.190-CNT2103-64 de Revisoría Fiscal;Medellín;El Cerro;120;0.24
1532;Quimulá, Guayacan Amarillo, Magnolio, Sauco de Monte;12/18/2021 12:00:00 AM;Obligación Contractual;Medellín;El Llano;13;0.026
1591;Quimulá, Guayacan Amarillo;10/13/2021 12:00:00 AM;Obligación Contractual;Medellín;El Llano;40;0.08
1287;Quimulá;10/28/2021 12:00:00 AM;Obligación Contractual;Medellín;El Llano (Santa Elena);14;0.028
1280;Amarraboyo, Arrayan Eugenio, Pino Colombiano Romeron, Roble;10/02/2021 0:00;Obligación Contractual;Medellín;El Llano (Santa Elena);46;0.092
1345;Quimulá, Cedro, Guayacan Polvillo;11/24/2021 12:00:00 AM;190-AO109-10 siembra obligacion contrctual;Medellín;El Llano (Santa Elena);19;0.038
1349;Quimulá, Cedro, Guayacan Polvillo, Arrayan de Hoja Pequeña, Roble;10/24/2021 12:00:00 AM;obligación contrato 0473-2021;Medellín;El Llano (Santa Elena);66;0.132
1667;Guayacan Rosado, Quiebrabarrigo, Cochobo, Cedro, Cabo de Hacha, Arrayan copa roja, Guayabo rojo, Guamo, Guayabo, Nogal Cafetero;11/14/2021 12:00:00 AM;Obligación Contractual;Medellín;El Picacho;21;0.042
194;Roble;10/04/2020 0:00;CUMPLIMIENTO OBLIGACION CONTRATO 150-CNT2007-95;Medellín;El Placer;1;0.002
2532;Quimulá, Guayacan Amarillo, Arrayán, Chirlobirlo;04/23/2022 12:00:00 AM;SEMBRATON POR EL DIA MUNDIAL DE LA TIERRA;Medellín;El Placer;1000;2
206;Quimulá, Abutilon Rojo, Canelo de Paramo, Chaquiro Real, Navajuelo, Sauco de Monte, Cheflera Mano de Oso, Aliso, Chagualo, Roble;10/04/2020 0:00;SEMBRATON BIO +;Medellín;El Placer;10;0.02
214;Quimulá, Cheflera Mano de Oso, Cedrillo, Navajuelo, Yolombo Pequeño, Olla de Mono, Aliso, Chagualo;10/04/2020 0:00;CUMPLIMIENTO OBLIGACIÓN CONTRATO 150-CNT2007-95;Medellín;El Placer;8;0.016
215;Nigüito;10/04/2020 0:00;CUMPLIMIENTO OBLIGACION CONTRATO 150-CNT2007-95;Medellín;El Placer;1;0.002
203;Aliso;10/04/2020 0:00;SEMBRATON BIO +;Medellín;El Placer;1;0.002
964;Alcaparro Enano;6/06/2021 0:00;Sembraron La Aldea;Medellín;El Plan;200;0.4
1283;Chaquiro Real, Gallinazo, Aguacatillo;9/06/2021 0:00;Siembra El Yolombo;Medellín;El Yolombo;24;0.048
1063;Quiebrabarrigo, Alcaparro Palo Bonito, Escobo 1;07/21/2021 12:00:00 AM;siembra;Medellín;El Yolombo;30;0.06
1276;Gallinazo, Chaquiro Real;08/16/2021 12:00:00 AM;siembra 2;Medellín;El Yolombo;16;0.032
770;EUCALIPTO;02/18/2021 12:00:00 AM;Salvemos a san Sebastián de Palmitas;Medellín;La Frisola;800;1.6
577;Gualanday;12/23/2020 12:00:00 AM;Sembraton Tejiendo Caminos -La Frisola;Medellín;La Frisola;300;0.6
1830;Quimulá, Guayacán Amarillo, Quiebrabarrigo, Camargo, Sauce, Guamo Machete, Níspero, Drago, Chirlobirlo, Roble;09/28/2021 12:00:00 AM;Obligación Contractual;Medellín;La Palma;61;0.122
244;Guayacán Amarillo;11/08/2020 0:00;Cada uno un árbol;Medellín;La Playas;1;0.002
196;Guayacán Amarillo, Cedro de Altura, Guayacán de Manizalez, Arboloco, Pino Colombiano Romeron, Sauco de Monte, Nadador, Alcaparro Enano, Barcino, Carate Negro, Casco de Vaca, Catape, Escobo 1, Guamo Liso, Guayabo Comun, Limón, Mango, Ojo de Pava, Sauce, Guasco, Drago, Aliso, Aguacatillo, Nogal Cafetero;10/09/2020 0:00;Compensación Bavaria;Medellín;La Verde;1000;2
35;Coralito, Tambor;5/09/2020 0:00;Más Bosques;Medellín;Las Palmas;2;0.004
31;Mango, Búcaro, Calaba;11/10/2019 0:00;Más bosques;Medellín;Las Palmas;3;0.006
32;Guayacán Amarillo, Chirlobirlo;12/12/2019 0:00;Más bosques;Medellín;Las Palmas;2;0.004
34;Chiminango, yarumo;5/03/2020 0:00;Mas bosques;Medellín;Las Palmas;2;0.004
36;Chiminango, Cresta de gallo, Búcaro, confite, Limón mandarina, Gualanday, Chirlobirlo;6/07/2020 0:00;Más bosques;Medellín;Las Palmas;10;0.02
33;lomo de caimán, Aguacate, Calaba;03/15/2020 12:00:00 AM;Más bosques;Medellín;Las Palmas;3;0.006
2533;Quimulá, Guayacan Amarillo, Arrayán, Chirlobirlo;3/10/2022 0:00;SEMBRANDO VIDAS;Medellín;Media Luna;1000;2
213;Quimulá, Guayacán Amarillo, Caunce, Amarraboyo, Yolombo Pequeño, Olla de Mono, Cedrillo, Simplocus, Chagualon, Guamo Peludo, Sietecueros, Ojo de Pava;10/20/2020 12:00:00 AM;Brindar el apoyo al programa Bio+, involucrándose en la siembra de mínimo 10 árboles-120-CNT2007-97;Medellín;Media Luna;14;0.028
510;Quimulá, Guayacán Amarillo, Guayabo Liso, Drago, Aguacatillo;01/22/2021 12:00:00 AM;Obligación Convenio N° 040-COV2010-204;Medellín;Media Luna;55;0.11
28;EUCALIPTO;6/05/2020 0:00;CELEBRACIÓN DIA DEL MEDIO AMBIENTE;Medellín;Pajarito;350;0.7
1231;Quimulá, Tachuelo 2, Arboloco, Pategallina;10/12/2021 0:00;Obligación Contractual;Medellín;Piedras Blancas-Matasano;100;0.2
1681;Eugenio, Amarraboyo Rosado, Navajuelo, Mortiño;02/19/2022 12:00:00 AM;190–CNT2201–59;Medellín;Piedras Blancas-Matasano;276;0.552
378;Quimulá, Cedro de Altura, Arrayyan, Canelo de Paramo, Cabo de Hacha, Cacho de Venado, Cedro Negro, Cheflera, Cordoncillo, Espadero Comun, Espadero Colorado, Laurel cordia, Mano de oso, Sauco de Monte, Croton, Escobo, Sauco, Drago, Aliso, Chagualo, Aguacatillo, Roble;08/15/2020 12:00:00 AM;Compensacion;Medellín;Piedras Blancas-Matasano;150;0.3
597;Arrayan Eugenio, Navajuelo, Chirlobirlo;1/04/2021 0:00;Siembra Contrato 190-CNT2011-152;Medellín;Piedras Blancas-Matasano;60;0.12
1190;Quimulá, Arboloco, Hayuelo, Aliso;09/22/2021 12:00:00 AM;Obligación Contractual;Medellín;Piedras Blancas-Matasano;500;1
1303;Guayacan Amarillo;8/05/2021 0:00;SALVEMOS LA RURALIDAD;Medellín;Potrera Miserenga;1000;2
591;Guayacán Amarillo, Alcaparro Gigante, Alcaparro Enano, Cámbulo, Gualanday, Chirlobirlo;4/03/2020 0:00;Campaña Adopta un arbol-Grupo Sueños Dorados (Tercera Edad);Medellín;Potrera Miserenga;1700;3.4
653;Guayacán Amarillo, Gualanday;07/27/2020 12:00:00 AM;Siembra-Corredor Verde Potrera Miserengo (proyecto ganador iniciativas Educativo Ambientales);Medellín;Potrera Miserenga;30;0.06
237;bálsamo;11/07/2020 0:00;Cada uno un árbol-Subdirección Administrativa y Financiera;Medellín;Potrerito;1;0.002
702;Quiebrabarrigo, Cedro de Altura, Arrayán, Guayacán de Manizalez, Alcaparro Criollo, Acacia Rosada, Arrayan de Hoja Ancha, Barcino, Caimito, Cascarilla Espinillo Blanco, Ceiba Verde Bonga, Chirimoya, Chocho, Encenillo, Abarco, Arrayan Eugenio, Cojon de Fraile, Guamo Liso, Guayacán Parasiempre, Laurel 1, Mamoncillo, Mestizo, Zanca de Mula, Nadador, carate rojo, Nispero, Algarrobillo, Caoba, Sauco de Monte, Surrumbo, totumo, Barbasco, Balso, Drago, Algarrobo, Algarrobo, Chagualo, Aguacatillo;03/29/2020 12:00:00 AM;SEMBRATON CERRO MEDELLIN;Medellín;Potrerito;315;0.63
705;grosello, MATARATON, NEEM, Quimulá, Guayacán Amarillo, Arrayán, Suribio, Alcaparro Criollo, Acacia Rosada, Barcino, Cacho de Venado, Cascarilla Espinillo Blanco, Chocho Rojo, Urapan, Guamo Liso, Jazmin de Noche, Laurel 1, Zanca de Mula, Ojo de Pava, Chocho, Balso, Algarrobo, Chagualo, Chirlobirlo, Aguacatillo, Nogal Cafetero;06/28/2020 12:00:00 AM;SEMBRATON CERRO MEDELLIN;Medellín;Potrerito;715;1.43
236;acacia amarilla, velero, pera de agua, bálsamo, Arizala, maíz tostado, bola de cañón, grosello, Guayacán Amarillo, Búcaro, Arrayan Eugenio, Gualanday;11/07/2020 0:00;Cada uno un árbol-Subdirección de Sostenibilidad y Gestión Territorial;Medellín;Potrerito;13;0.026
359;Guayacán Amarillo, Arrayan Eugenio, Limón Tahiti, Mango Tommy, Naranja Tangelo, Mandarina Oneco, Aguacate;11/28/2020 12:00:00 AM;Siembra contratista;Medellín;Potrerito;11;0.022
242;Pero de agua, Chagualo;11/07/2020 0:00;Cada uno un árbol;Medellín;Potrerito;2;0.004
267;Guayacan Rosado, Chagualo Amarillo;11/07/2020 0:00;Cada uno un árbol;Medellín;Potrerito;5;0.01
404;Pimiento de Arbol, Drago, Roble;12/13/2020 12:00:00 AM;150-CNT2009-128;Medellín;San José;20;0.04
241;Nispero, Aguacatillo;11/07/2020 0:00;Cada uno un árbol;Medellín;San José de la Montaña;2;0.004
1153;Quimulá, Chaquiro Real, Gallinazo, Nigúito, Palma de Cera Cafetera, Yolombo Blanco, Drago, Chagualo, Roble;09/19/2021 12:00:00 AM;Obligación Contractual;Medellín;San José de la Montaña;75;0.15
1344;Quimulá, Guayacan Amarillo, Arrayán, Roble;10/25/2021 12:00:00 AM;Obligación Contractual;Medellín;Santa Elena Sector Central;55;0.11
1333;Quimulá, Guayacan Amarillo, Guayabo Liso, Acacia, Roble;10/28/2021 12:00:00 AM;SEMBRATON;Medellín;Santa Elena Sector Central;270;0.54
1341;olivo de cera, Alcaparro Enano, Chirlobirlo;11/14/2021 12:00:00 AM;Obligación Contractual;Medellín;Santa Elena Sector Central;12;0.024
1286;Quimulá, Acacia, Nogal Cafetero;10/28/2021 12:00:00 AM;Siembra relacionada al contrato No. 110-CNT2101-5;Medellín;Santa Elena Sector Central;32;0.064
1331;Quimulá, Guayacán Amarillo, Acacia, Nogal Cafetero, Roble;10/13/2021 12:00:00 AM;Obligación Contractual;Medellín;Santa Elena Sector Central;1802;3.604
1675;Quimulá, Acacia, Nogal Cafetero, Roble;10/28/2021 12:00:00 AM;Obligación Contractual;Medellín;Santa Elena Sector Central;20;0.04
1342;olivo de cera, Alcaparro Enano, Chirlobirlo;11/14/2021 12:00:00 AM;Obligación Contractual;Medellín;Santa Elena Sector Central;22;0.044
1337;olivo de cera, Alcaparro Enano, Chirlobirlo;11/14/2021 12:00:00 AM;Obligación Contractual;Medellín;Santa Elena Sector Central;32;0.064
1131;Roble;04/22/2021 12:00:00 AM;sembraton;Medellín;Santa Elena Sector Central;3100;6.2
1757;Quimulá, Guayacan Amarillo, Arrayan de Hoja Pequeña;3/10/2022 0:00;Obligación Contractual;Medellín;Santa Elena Sector Central;75;0.15
1332;Quimulá, Arboloco, Guayabo Liso;10/28/2021 12:00:00 AM;SEMBRATON;Medellín;Santa Elena Sector Central;2000;4
1666;Quimulá, Acacia, Nogal Cafetero;10/28/2021 12:00:00 AM;Obligación Contractual;Medellín;Santa Elena Sector Central;15;0.03
239;Guayabo Comun, Ceiba de Tierra Fria;11/07/2020 0:00;SEMBRATON;Medellín;Santa Elena Sector Central;2;0.004
1175;Amarraboyo, Arrayan Eugenio, Pino Colombiano Romeron, Roble;10/02/2021 0:00;Obligación Contractual;Medellín;Santa Elena Sector Central;46;0.092
686;Cedro, nogal, guayacán;10/12/2020 0:00;Sembraton;Medellín;Sector Central;500;1
328;Carbonero;10/31/2020 12:00:00 AM;Siembra de árboles- Comuna Castilla Med;Medellín;Sector Central;2;0.004
330;BALA DE CAÑON, acacia amarilla;10/31/2020 12:00:00 AM;Siembra de Árboles Comuna Castilla Med;Medellín;Sector Central;3;0.006
329;Frutegallina;10/31/2020 12:00:00 AM;Siembra de árboles Comuna Castilla Med;Medellín;Sector Central;3;0.006
238;Suribio, Naranjo, Limón, Guayaba Freijoa;11/07/2020 0:00;Cada uno un árbol;Medellín;Sector Central;8;0.016
331;JAGUA (GENIPA AMERICANA), ARIZA (BROWNEA ARIZA), PECHUGA DE GALLINA (HASSELTIA FLORIBUNDA), INCHI (CARYODENDRON ORINOCENSE), BALA DE CAÑON;11/07/2020 0:00;Siembra de Árboles Comuna Castilla Med;Medellín;Sector Central;10;0.02
246;Guayacán Amarillo, Guayacan Rosado, Tulipan;11/08/2020 0:00;Sembraton Corantioquia;Medellín;Travesias;4;0.008
590;Acacia Roja, Cámbulo, Alcaparro Enano, Alcaparro Gigante;08/19/2020 12:00:00 AM;Sembraton;Medellín;Volcana Guayabal;850;1.7
578;pomos, Guayacán Amarillo, Guayacan Rosado, Alcaparro Gigante, Acacia Roja, Alcaparro Enano, Cámbulo, Chirlobirlo, Nogal Cafetero;08/19/2019 12:00:00 AM;Campaña bosques Propios Rurales - Tejiendo Caminos;Medellín;Volcana Guayabal;4665;9.33
706;ARDISIA, CACAO, CASEARIA VARABLANCA, CHICALA, FRANCESINO, grosello, MATARATON, NEEM, Guayacán Amarillo, Arrayán, Suribio, Alcaparro Enano, Barcino, Chocho, Jazmin de Noche, Laurel 1, Mestizo, Ojo de Pava, Chocho Rojo, Guamo Liso, Arrayan de Hoja Ancha, Balso, Algarrobo, Chagualo, Chirlobirlo, Aguacatillo, Nogal Cafetero, Roble;10/12/2020 0:00;SEMBRATON CERRO MEDELLIN;Medellín;Expansion Urbana;720;1.44
1773;Cedro, Chocho Alcaparro, Guamo Machete, Hobo, Nadador, olivo de cera, Pavo Tabaquillo, Tabaquillo, Aliso, Chachafruto;09/15/2021 12:00:00 AM;Obligación Contractual;Medellín;Expansion Urbana;15;0.03
229;Mango;11/07/2020 0:00;Cada uno un árbol;Medellín;Expansion Urbana;1;0.002
223;Guayacán Amarillo, Tulipan africano;11/07/2020 0:00;Cada uno un árbol;Medellín;Jalisco;2;0.004
1195;Yarumo Negro, Carbonero;09/26/2021 12:00:00 AM;Obligación Contractual;Amagá;Camilo C;20;0.04
1211;Cedro Rojo, Cámbulo, Yarumo Blanco, Chicalas;10/10/2021 0:00;Obligación Contractual;Amagá;Camilo C;90;0.18
2267;Roble;11/11/2021 0:00;SEMBRATON APOYO;Amagá;Malabrigo;3000;6
172;Guayabo Comun;10/01/2020 0:00;sembraton la gurria;Amalfi;Cabecera Municipal;300;0.6
1858;Cedro, Suribio, Casco de Vaca, Vara Santa, Dinde, Payandé, Móncoro, Ceiba rosada, Samán;11/10/2021 0:00;Obligación Contractual;Amalfi;El Taparo;30;0.06
683;Guayacán de Manizalez, Acacia Rosada;02/23/2021 12:00:00 AM;Convenio 040-cov2009-116 JAC LA MARIA;Amalfi;La Maria;65;0.13
694;Cedro de Altura, Guayacán de Manizalez, Acacia Rosada, Pestaña de Mula, Almendro, Samán;12/22/2020 12:00:00 AM;CONVENIO 040-COV2010-155  SANEAMIENTO HIDRICO;Amalfi;La Vibora;190;0.38
1140;Quiebrabarrigo, Suribio, Matarratón, Chocho, Guadua, Samán;9/10/2021 0:00;Siembra relacionada al contrato No. 110-CNT2011-148;Amalfi;La Vibora;74;0.148
1234;Quiebrabarrigo, Matarratón, Guadua;09/17/2021 12:00:00 AM;Obligación contractual contrato 110-CNT2011-153;Amalfi;La Vibora;52;0.104
1162;Quiebrabarrigo, Suribio, Matarratón, Chocho, Guadua, Samán;09/27/2021 12:00:00 AM;Obligación contractual 110-CNT2011-148;Amalfi;La Vibora;73;0.146
1137;Quiebrabarrigo, Matarratón, Guadua;9/10/2021 0:00;Obligación contractual;Amalfi;La Vibora;53;0.106
1138;Quiebrabarrigo, Matarratón, Guadua;9/10/2021 0:00;Obligación contractual;Amalfi;La Vibora;52;0.104
1870;Guayacán Amarillo, Quiebrabarrigo, Cedro, Cedro, piñon de oreja, Mataratón, Acacia, Guamo Machete, Guayacán Amarillo, Búcaro, Caoba, Guayabo Argelino, Falsa acacia, Eugenio, Pimiento de Arbol, Balso, Samán;11/18/2021 12:00:00 AM;Obligación Contractual;Amalfi;La Vibora;2766;5.532
1235;Quiebrabarrigo, Matarratón, Guadua;09/27/2021 12:00:00 AM;Obligación contractual contrato N°110-CNT2011-153;Amalfi;La Vibora;53;0.106
1139;Quiebrabarrigo, Suribio, Matarratón, Chocho, Guadua, Samán;9/10/2021 0:00;Siembra relacionada al contrato No. 110-CNT2011-148;Amalfi;La Vibora;73;0.146
1161;Quiebrabarrigo, Suribio, Matarratón, Chocho, Guadua, Samán;09/17/2021 12:00:00 AM;Obligación contractual 110-CNT2011-148;Amalfi;La Vibora;72;0.144
693;Guayacán de Manizalez, Acacia Rosada, Guacimo, Tambor;12/14/2020 12:00:00 AM;CONVENIO 040-COV2010-184  CORREGIMIENTO PORTACHUELO;Amalfi;Portachuelo;70;0.14
1710;Tambor, Almendro;3/03/2022 0:00;Enajenar a título gratuito al Municipio de Amalfi, recurso maderable objeto de decomiso definitivo y posterior disposición final  040-COV2106-25;Amalfi;Tintacita;200;0.4
883;Arbol del pan;04/29/2021 12:00:00 AM;adopta un arbol por la vida;Andes;Cabecera Municipal;1;0.002
383;Cedro rosado, Guayacan Amarillo, Guamo, Balso, Carbonero, Nogal Cafetero;12/11/2020 0:00;Sembratón;Andes;Cabecera Municipal;56;0.112
382;Guayacán Amarillo, Cedro Amarillo, Gualanday;12/04/2020 0:00;040-COV2010-175/MUNICIPIO DE ANDES Y JAC ALIANZA CÍVICA TAPARTÓ;Andes;Cabecera Municipal;40;0.08
431;Guayacán Amarillo, Cedro de Altura, Gualanday, Nogal Cafetero;12/11/2020 0:00;040-COV2010-175/MUNICIPIO DE ANDES Y JAC ALIANZA CÍVICA CAMPESINA TAPARTÓ;Andes;Cabecera Municipal;40;0.08
889;velero;04/29/2021 12:00:00 AM;adopta un árbol por la vida;Andes;Cabecera Municipal;2;0.004
1515;Suribio, Guamo Liso, Carbonero, Aguacatillo;12/06/2021 0:00;Siembra Ecoparque;Andes;Alto Cañaveral;146;0.292
971;clitoria, Zapote;04/29/2021 12:00:00 AM;ADOPTA UN ARBOL POR LA VIDA;Andes;Barcino;6;0.012
914;velero;04/29/2021 12:00:00 AM;ADOPTA UN ARBOL POR LA VIDA;Andes;El Barcinto;3;0.006
969;clitoria;04/29/2021 12:00:00 AM;adopta un arbol por la vida;Andes;El Líbano;3;0.006
968;Zapote, Algarrobo;04/29/2021 12:00:00 AM;ADOPTA UN ARBOL POR LA VIDA;Andes;La Ermita;2;0.004
1290;Guayacan Amarillo, Suribio, Chumbimbo, Algarrobo;10/12/2021 0:00;SEMBRATON 12 DE OCTUBRE;Andes;La Piedra;1000;2
1711;Piñón de Oreja, Nispero, Madroño, Mestizo, Tautano Trompillo, Guamo Churimo, Guayabo Comun, Tulipan;02/15/2022 12:00:00 AM;Obligación Contractual;Andes;La Pradera;46;0.092
647;Bauhinia picta, Tulipán Africano, Guayacán Amarillo;02/13/2021 12:00:00 AM;Siembra Cumplimiento Cláusula Quinta Numeral 12 Contrato No.190-CNT2101-21;Andes;La Pradera;40;0.08
645;Bauhinia picta, Tulipán Africano, Guayacán Amarillo;02/13/2021 12:00:00 AM;Siembra Cumplimiento Cláusula Quinta Numeral 08 Contrato No.190-CNT2101-18;Andes;La Pradera;63;0.126
1670;Guayacan Amarillo, Leucaena, Guamo santafereño, Gualanday, Nogal Cafetero;12/06/2021 0:00;Obligación Contractual;Andes;La Rochela;423;0.846
967;Zapote, clitoria, Algarrobo, Samán;04/29/2021 12:00:00 AM;ADOPTA UN ARBOL POR LA VIDA;Andes;La Solita;6;0.012
605;Guamo, Guayacan Amarillo, Cedro de Altura, totumo, Leucaena, Samán, Aguacatillo;09/25/2020 12:00:00 AM;sembraton;Andes;Las Colonias;1900;3.8
602;Pino Colombiano Romeron, Balso;6/05/2020 0:00;sembraton;Andes;Las Colonias;100;0.2
1085;Guayacán Amarillo;04/24/2021 12:00:00 AM;sembraton;Andes;Las Colonias;50;0.1
599;Balso, Nogal Cafetero;05/16/2020 12:00:00 AM;sembraton;Andes;Las Colonias;2000;4
603;Nogal Cafetero;07/28/2020 12:00:00 AM;sembraton;Andes;Las Colonias;1000;2
911;Quiebrabarrigo;04/29/2021 12:00:00 AM;adopta un árbol por la vida;Andes;Palestina;6;0.012
2269;Quimulá;02/15/2021 12:00:00 AM;SEMBRATON APOYO;Andes;San Agustín;1080;2.16
2268;Sauco de Monte;2/07/2021 0:00;SEMBRATON APOYO;Andes;San Agustín;1000;2
558;Guamo Liso;12/04/2020 0:00;sembraton navideño;Andes;San Agustín;50;0.1
2274;Quiebrabarrigo, Aguacatillo;10/15/2021 12:00:00 AM;SEMBRATON APOYO;Andes;San Agustín;8000;16
572;Cedro Rojo;12/04/2020 0:00;Sembraton Navideña;Andes;San Agustín;50;0.1
557;EUCALIPTO;12/04/2020 0:00;sembraton navideña;Andes;San Agustín;50;0.1
555;Cedro Rojo;12/04/2020 0:00;Sembratón navideña;Andes;San Agustín;50;0.1
2273;Cedro de Altura, Cedro Negro;10/07/2021 0:00;SEMBRATON APOYO;Andes;San Agustín;19000;38
2272;Chirlobirlo;6/09/2021 0:00;SEMBRATON APOYO;Andes;San Agustín;500;1
2271;Sauce;05/21/2021 12:00:00 AM;SEMBRATON APOYO;Andes;San Agustín;1520;3.04
2270;Chachafruto;04/30/2021 12:00:00 AM;SEMBRATON APOYO;Andes;San Agustín;200;0.4
884;Algarrobo;04/29/2021 12:00:00 AM;ADOPTA UN ARBOL POR LA VIDA;Andes;San Antonio;2;0.004
972;Zapote, clitoria;04/29/2021 12:00:00 AM;ADOPTA UN ARBOL POR LA VIDA;Andes;San Antonio;6;0.012
974;clitoria;04/29/2021 12:00:00 AM;ADOPTA UN ARBOL POR LA VIDA;Andes;San Bartolo;6;0.012
890;SAMANES;04/29/2021 12:00:00 AM;ADOPTA UN ARBOL POR LA VIDA;Andes;San Bartolo;2;0.004
313;Balso Blanco, carate rojo, Cordoncillo, Aguacatillo;10/04/2020 0:00;SEMBRATON;Andes;San Perucho;10;0.02
970;Zapote;04/29/2021 12:00:00 AM;Adopta un Árbol por la Vida;Andes;San Perucho;4;0.008
314;Guayacán Amarillo, Puntalanza, Pino Colombiano Romeron, Roble;10/05/2020 0:00;SEMBRATON;Andes;San Perucho;20;0.04
600;Nogal Cafetero;05/29/2020 12:00:00 AM;SEMBRATON;Andes;Santa Elena;2000;4
604;Nogal Cafetero;06/29/2020 12:00:00 AM;sembraton;Andes;Santa Elena;1600;3.2
598;Nogal Cafetero;2/04/2020 0:00;sembraton;Andes;Expansion Urbana;600;1.2
384;Aliso;10/01/2020 0:00;sembraton;Angelópolis;El Nudillo;100;0.2
1778;Quiebrabarrigo, Duraznillo, liberal, Alcaparro Enano, Cordoncillo, yarumo, laurel, Navajuelo, grosello, Guamo Machete, Balso, Roble;09/18/2021 12:00:00 AM;Obligación Contractual;Angelópolis;El Nudillo;34;0.068
1738;EUCALIPTO, laurel, Aguacatillo;3/09/2022 0:00;sembraton;Angelópolis;La Clara;225;0.45
310;carate rojo, Pino Colombiano Romeron, Cordoncillo, Chachafruto, Aguacatillo, Roble;10/01/2020 0:00;SEMBRATON;Angelópolis;La Clara;30;0.06
1779;Guayabo Común, Guayacán de manizales, Escobo, Duraznillo, laurel, Chachafruto, Aguacatillo;09/18/2021 12:00:00 AM;Obligación Contractual;Angelópolis;La Clara;36;0.072
1765;Arrayán de hoja pequeña, Ceiba rosada, laurel Nativo, Níspero Japón, Espadero, Pino Romeron, Aliso;08/29/2021 12:00:00 AM;Obligación Contractual;Angelópolis;Santa Barbara;31;0.062
1865;Cedro, Cámbulo, Caoba, Carbonero, Nogal Cafetero;11/12/2021 0:00;Obligación Contractual;Angostura;Cabecera Municipal;50;0.1
417;Carbonero;12/21/2020 12:00:00 AM;Siembra Granja Buena Vista II;Angostura;Batea Seca;14;0.028
1514;Carbonero;12/18/2021 12:00:00 AM;Obligación Contractual;Angostura;Chocho Rio;14;0.028
355;Acacia Rosada, Carbonero, Nogal Cafetero;12/02/2020 0:00;Siembraton Cedal II;Angostura;El Olivo;210;0.42
397;Acacia Roja, Carbonero, Nogal Cafetero;12/02/2020 0:00;Sembraton Cedral II;Angostura;El Olivo;210;0.42
1239;Guayacan Amarillo, Arrayan de Hoja Ancha, Cedro Negro;10/12/2021 0:00;Gran Sembratón Cada uno, un árbol;Angostura;El Olivo;1500;3
2275;Roble;10/15/2021 12:00:00 AM;SEMBRATON APOYO;Angostura;La Culebra;1500;3
2276;Quimulá;11/26/2021 12:00:00 AM;SEMBRATON APOYO;Angostura;La Culebra;31679;63.358
2277;Sauce;10/20/2021 12:00:00 AM;SEMBRATON APOYO;Angostura;La Culebra;1000;2
219;Guayabo Comun, Guadua;10/15/2020 12:00:00 AM;Jornada Educativa de Reforestación;Angostura;La Milagrosa;400;0.8
1716;Quiebrabarrigo;2/10/2022 0:00;Jornada Ecológico Convite forestación;Angostura;La Quinta;250;0.5
817;Guayacan Rosado, Quiebrabarrigo, velero, Carbonero;12/02/2020 0:00;Obligación Contractual;Angostura;Maldonado;150;0.3
1308;Cedro de Altura, Piñón de Oreja, Matarratón;10/12/2021 0:00;SEMBRATON 12 DE OCTUBRE;Angostura;Maldonado;1500;3
2558;Quiebrabarrigo, Cedro, Guayacan Amarillo, Matarratón, Cambulo, Caoba, Arboloco, Bucaro, Acacia, Carbonero, Gualanday, Samán, Chirlobirlo, Nogal Cafetero;04/22/2022 12:00:00 AM;Siembra en placa huella Granja Escuela Buena Vista;Angostura;Mata Blanco;460;0.92
1092;Guayacán Amarillo;8/08/2021 0:00;Obligación Contractual;Angostura;Pajarito Arriba;17;0.034
476;Aguacatillo;08/27/2020 12:00:00 AM;Sembraton;Angostura;Tenche Viejo;3;0.006
125;Guadua, Guayabo Comun, Acacia Rosada, Gualanday;08/28/2020 12:00:00 AM;Sembraton en la vereda Tenche viejo;Angostura;Tenche Viejo;1100;2.2
485;Nogal Cafetero;08/27/2020 12:00:00 AM;Sembraton;Angostura;Tenche Viejo;3;0.006
285;Aguacatillo;08/28/2020 12:00:00 AM;Sembraton municipio de Angostura;Angostura;Tenche Viejo;3;0.006
480;Nogal Cafetero;09/22/2020 12:00:00 AM;Jornada de sembraton programa Bio+;Anorí;Cabecera Municipal;4;0.008
366;Guayacan Rosado, Guayacán de Manizalez;12/07/2020 0:00;Siembra convenio 040-COV2010-159 de 2020;Anorí;Cabecera Municipal;83;0.166
1062;Moringa Forestal, Doncel, Guayacán Amarillo, Quiebrabarrigo, Arrayán, Matarratón, Jagua, Mamoncillo, Tachuelo 2, Almendro, velero, Ceiba Bonga, Pero de agua, Clavellino, Arrayan Eugenio, Acacia Roja, Alcaparro Criollo, azuceno, Ébano, Guamo Liso, grosello, Vara blanca, Carbonero, Chachafruto, Samán;07/21/2021 12:00:00 AM;Actividad sembraton en el municipio de Anorí;Anorí;Cabecera Municipal;1000;2
482;Palma Macana;11/06/2020 0:00;Jornada de sembraton cada uno un árbol;Anorí;Cabecera Municipal;2;0.004
1054;Quiebrabarrigo, Guayacan Amarillo, Matarratón, Vara blanca, Arrayán blanco, azuceno, Ébano, Eugenio, grosello, ARDISIA, velero, Almendro, Tachuelo, Jagua, Poma rosa, Ceiba Bonga, Chocho, Clavellino, Acacia Roja, Guamo Liso, Mamoncillo, Mamoncillo, Carbonero, Chachafruto, Samán;07/21/2021 12:00:00 AM;Obligacion Contractual;Anorí;Cabecera Municipal;1000;2
289;Palma Macana;11/06/2020 0:00;Cada uno un árbol;Anorí;Cabecera Municipal;2;0.004
288;Arboloco;09/22/2020 12:00:00 AM;Sembraton;Anorí;Cabecera Municipal;4;0.008
195;Abutilon Rojo;10/25/2020 12:00:00 AM;Siembra Greenknow;Anorí;El Limón;19;0.038
1419;Guayacan, Matarratón, Guayabo Alma negra, Hamelia coralito, Hayuelo Verde, Higueron, Jazmin de Noche, laurel, Magnolio, Mantequillo, meliosma, Mortiño, Navajuelo, Olleto, Pechuga de Gallina, Pestaña de Mula, Pino Romeron;09/15/2021 12:00:00 AM;Siembra por compensacion - Pavimentación vía Anorí - El Limon;Anorí;El Retiro;3567;7.134
1420;Quiebrabarrigo, Suribio, Sarro, Sauco de Monte, yarumo, Abutilon, Camaron, Kalanchoe, Uva de monte, Verbena, Gardenia, Hortensia, Silbo, Roble;10/11/2021 0:00;Siembra por compensacion - Pavimentación vía Anorí - El Limon;Anorí;El Retiro;2926;5.852
